{
  "schemaVersion": 1,
  "hashDomain": "ProviderPricingSource.v1",
  "observationType": "official_documentation_observation",
  "providerId": "openai-responses",
  "apiModel": "gpt-5.6-luna",
  "modelIdentity": "openai:gpt-5.6-luna@alias-observed-2026-07-31",
  "currency": "USD",
  "inputMicrosPerMillionTokens": 1000000,
  "cachedInputMicrosPerMillionTokens": 100000,
  "cacheWriteMicrosPerMillionTokens": 1250000,
  "outputMicrosPerMillionTokens": 6000000,
  "reasoningIncludedInOutput": true,
  "observedAt": "2026-07-31T00:00:00.000Z",
  "sourceUrls": [
    "https://developers.openai.com/api/docs/models/gpt-5.6-luna",
    "https://developers.openai.com/api/docs/guides/latest-model"
  ]
}
